{
  "title": "Naast hypotheekadvies nog hulp nodig?",
  "subject_line": "Naast hypotheekadvies nog hulp nodig?",
  "preheader": "Bekijk de gemiddelde kosten van een vastgoedmakelaar, een EPC of een advocaat en vraag gratis een prijsindicatie op.",
  "hero_image_url": "https://img.mailinblue.com/9986607/images/rnb/original/6aaa43ab51ca571010aeccb7.jpg",
  "hero_image_alt": "Hypotheekadviseur aan het werk: hypotheekopties bespreken met een stel",
  "hero_title_pre": "Naast hypotheekadvies nog",
  "hero_title_accent": "hulp",
  "hero_title_post": "nodig?",
  "hero_subtitle": "U zocht onlangs via Trustlocal een hypotheekadviseur. Van een vastgoedmakelaar tot uw EPC: dit is wat u nog meer kunt regelen.",
  "campaign_key": "crosssell_reminder_hypotheekadvies",
  "services_heading_pre": "Wat moet u nog meer",
  "services_heading_accent": "regelen?",
  "services_heading_post": "",
  "services_intro": "Op Trustlocal vergelijkt u de beste bedrijven bij u in de buurt voor ruim 50 verschillende diensten. Vraag gratis en vrijblijvend een prijsindicatie aan.",
  "grid_style": "",
  "stack_style": "display:none; mso-hide:all;",
  "stack2_style": "display:none; mso-hide:all;",
  "stack3_style": "display:none; mso-hide:all;",
  "service1_name": "Vastgoedmakelaar",
  "service1_label": "Voor kopen of verkopen",
  "service1_text": "Een vastgoedmakelaar die meezoekt en voor u onderhandelt.",
  "service1_price": "€ 1.500 – € 5.500",
  "service1_url": "https://trustlocal.be/belgie/vastgoedmakelaar/?utm_source=brevo&utm_campaign=crosssell_reminder_hypotheekadvies&utm_medium=email&utm_content=kaart1",
  "service1_link_label": "Ontvang prijsindicatie",
  "service1_image_url": "https://img.mailinblue.com/9986607/images/rnb/original/6a99ca52be55c06bad68f869.jpg",
  "service1_image_alt": "Vastgoedmakelaar aan het werk: woning inspecteren met kopers",
  "service2_name": "EPC-keurder",
  "service2_label": "Voor uw EPC",
  "service2_text": "Een EPC als u de woning verkoopt of energiezuiniger wilt maken.",
  "service2_price": "€ 250 – € 350",
  "service2_url": "https://trustlocal.be/belgie/epc-keuring/?utm_source=brevo&utm_campaign=crosssell_reminder_hypotheekadvies&utm_medium=email&utm_content=kaart2",
  "service2_link_label": "Ontvang prijsindicatie",
  "service2_image_url": "https://img.mailinblue.com/9986607/images/rnb/original/6a99ca6625aaba004d88df8e.jpg",
  "service2_image_alt": "EPC-keurder aan het werk: isolatie en raam controleren",
  "service3_name": "Advocaat",
  "service3_label": "Voor juridisch advies",
  "service3_text": "Juridisch advies bij contracten en afspraken rond uw aankoop.",
  "service3_price": "€ 150 – € 350 per uur",
  "service3_url": "https://trustlocal.be/belgie/advocaat/?utm_source=brevo&utm_campaign=crosssell_reminder_hypotheekadvies&utm_medium=email&utm_content=kaart3",
  "service3_link_label": "Ontvang prijsindicatie",
  "service3_image_url": "https://img.mailinblue.com/9986607/images/rnb/original/6aaa43acfd8ef40f6e584545.jpg",
  "service3_image_alt": "Advocaat aan het werk: juridisch advies geven aan een cliënt",
  "service4_name": "Financieel adviseur",
  "service4_label": "Voor financieel advies",
  "service4_text": "Financieel advies over uw woonlasten en plannen voor uw woning.",
  "service4_price": "€ 100 – € 140 per uur",
  "service4_url": "https://trustlocal.be/belgie/financieel-adviseur/?utm_source=brevo&utm_campaign=crosssell_reminder_hypotheekadvies&utm_medium=email&utm_content=kaart4",
  "service4_link_label": "Ontvang prijsindicatie",
  "service4_image_url": "https://img.mailinblue.com/9986607/images/rnb/original/6a99ca67b423db7c1ead99b1.jpg",
  "service4_image_alt": "Financieel adviseur aan het werk: financieel plan uitleggen aan klant",
  "prices_note": "Gemiddelde prijzen op Trustlocal.be. Wat u betaalt, hangt af van uw situatie.",
  "closing_heading_pre": "Hebt u al een hypotheekadviseur",
  "closing_heading_accent": "gevonden?",
  "closing_heading_post": "",
  "closing_intro": "Uw aanvraag staat nog open. Hebt u al iemand gevonden of hebt u geen hulp meer nodig? Werk uw aanvraag bij in Mijn aanvragen.",
  "all_services_label": "Alle diensten bekijken",
  "all_services_url": "https://trustlocal.be/alle-diensten/?utm_source=brevo&utm_campaign=crosssell_reminder_hypotheekadvies&utm_medium=email&utm_content=allediensten",
  "dashboard_label": "Mijn aanvraag bijwerken"
}
