{
  "title": "Naast een glazenwasser nog hulp nodig?",
  "subject_line": "Naast een glazenwasser nog hulp nodig?",
  "preheader": "Bekijk de gemiddelde kosten van een schoonmaak, gevelwerk of tuinonderhoud en vraag gratis een prijsindicatie op.",
  "hero_image_url": "https://img.mailinblue.com/9986607/images/rnb/original/6a99ca71be55c06bad68f875.jpg",
  "hero_image_alt": "Glazenwasser aan het werk: grote ramen reinigen",
  "hero_title_pre": "Naast een glazenwasser nog",
  "hero_title_accent": "hulp",
  "hero_title_post": "nodig?",
  "hero_subtitle": "U zocht onlangs via Trustlocal een glazenwasser. Van een grote schoonmaak tot uw tuin: dit is wat u nog meer voor uw huis kunt laten doen.",
  "campaign_key": "crosssell_reminder_glazenwasser",
  "services_heading_pre": "Wat staat er nog op uw",
  "services_heading_accent": "lijstje?",
  "services_heading_post": "",
  "services_intro": "Op Trustlocal vergelijkt u de beste bedrijven bij u in de buurt voor ruim 50 verschillende diensten. Vraag gratis en vrijblijvend een prijsindicatie aan.",
  "grid_style": "",
  "stack_style": "display:none; mso-hide:all;",
  "stack2_style": "display:none; mso-hide:all;",
  "stack3_style": "display:none; mso-hide:all;",
  "service1_name": "Schoonmaakbedrijf",
  "service1_label": "Voor een schoon huis",
  "service1_text": "Een grondige schoonmaak van de ruimtes achter uw schone ramen.",
  "service1_price": "€ 20 – € 40 per uur",
  "service1_url": "https://trustlocal.be/belgie/schoonmaakbedrijf/?utm_source=brevo&utm_campaign=crosssell_reminder_glazenwasser&utm_medium=email&utm_content=kaart1",
  "service1_link_label": "Ontvang prijsindicatie",
  "service1_image_url": "https://img.mailinblue.com/9986607/images/rnb/original/6a99ca84d6d15096d2e48ab9.jpg",
  "service1_image_alt": "Professionele schoonmaker aan het werk: keukenoppervlak grondig reinigen",
  "service2_name": "Gevelspecialist",
  "service2_label": "Voor een schone gevel",
  "service2_text": "Een reiniging die past bij het materiaal van uw gevel.",
  "service2_price": "€ 1.500 – € 3.000",
  "service2_url": "https://trustlocal.be/belgie/gevelrenovatie/?utm_source=brevo&utm_campaign=crosssell_reminder_glazenwasser&utm_medium=email&utm_content=kaart2",
  "service2_link_label": "Ontvang prijsindicatie",
  "service2_image_url": "https://img.mailinblue.com/9986607/images/rnb/original/6a99ca7025aaba004d88df8f.jpg",
  "service2_image_alt": "Gevelspecialist aan het werk: voegwerk herstellen",
  "service3_name": "Tuinonderhoudbedrijf",
  "service3_label": "Voor uw tuin",
  "service3_text": "Hagen en borders bijwerken, zodat ook het zicht naar buiten klopt.",
  "service3_price": "€ 35 – € 50 per uur",
  "service3_url": "https://trustlocal.be/belgie/tuinaanleg-en-tuinonderhoud/?utm_source=brevo&utm_campaign=crosssell_reminder_glazenwasser&utm_medium=email&utm_content=kaart3",
  "service3_link_label": "Ontvang prijsindicatie",
  "service3_image_url": "https://img.mailinblue.com/9986607/images/rnb/original/6a99ca73be55c06bad68f876.jpg",
  "service3_image_alt": "Tuinonderhoudbedrijf aan het werk: planten en borders aanleggen",
  "service4_name": "Zonweringspecialist",
  "service4_label": "Voor koelte en privacy",
  "service4_text": "Zonwering nakijken of vervangen als doek of bediening versleten is.",
  "service4_price": "€ 500 – € 1.000",
  "service4_url": "https://trustlocal.be/belgie/zonwering/?utm_source=brevo&utm_campaign=crosssell_reminder_glazenwasser&utm_medium=email&utm_content=kaart4",
  "service4_link_label": "Ontvang prijsindicatie",
  "service4_image_url": "https://img.mailinblue.com/9986607/images/rnb/original/6aaa43aefd8ef40f6e584546.jpg",
  "service4_image_alt": "Zonweringsmonteur aan het werk: zonwering monteren aan de gevel",
  "prices_note": "Gemiddelde prijzen op Trustlocal.be. Wat u betaalt, hangt af van uw woning.",
  "closing_heading_pre": "Hebt u al een glazenwasser",
  "closing_heading_accent": "gevonden?",
  "closing_heading_post": "",
  "closing_intro": "Uw aanvraag staat nog open. Hebt u al iemand gevonden of hebt u geen hulp meer nodig? Werk uw aanvraag bij in Mijn aanvragen.",
  "all_services_label": "Alle diensten bekijken",
  "all_services_url": "https://trustlocal.be/alle-diensten/?utm_source=brevo&utm_campaign=crosssell_reminder_glazenwasser&utm_medium=email&utm_content=allediensten",
  "dashboard_label": "Mijn aanvraag bijwerken"
}
