{
  "title": "Naast rioolwerk nog meer hulp nodig?",
  "subject_line": "Naast rioolwerk nog meer hulp nodig?",
  "preheader": "Bekijk de gemiddelde kosten van een loodgieter, vochtbestrijding of bestrating en vraag gratis een prijsindicatie op.",
  "hero_image_url": "https://img.mailinblue.com/9986607/images/rnb/original/6a99ca8825aaba004d88df97.jpg",
  "hero_image_alt": "Rioolservice aan het werk: afvoer inspecteren met camera-apparatuur",
  "hero_title_pre": "Naast rioolwerk nog meer",
  "hero_title_accent": "hulp",
  "hero_title_post": "nodig?",
  "hero_subtitle": "Je zocht onlangs via Trustoo een rioolspecialist. Van leidingwerk tot tuinaanleg: dit is wat je nog meer voor je huis kunt laten doen.",
  "campaign_key": "crosssell_reminder_rioolservice",
  "services_heading_pre": "Wat staat er nog op je",
  "services_heading_accent": "lijstje?",
  "services_heading_post": "",
  "services_intro": "Op Trustoo vergelijk je de beste bedrijven bij jou in de buurt voor wel 87 verschillende diensten. Vraag gratis en vrijblijvend offertes aan.",
  "grid_style": "",
  "stack_style": "display:none; mso-hide:all;",
  "stack2_style": "display:none; mso-hide:all;",
  "stack3_style": "display:none; mso-hide:all;",
  "service1_name": "Loodgieter",
  "service1_label": "Voor water en afvoer",
  "service1_text": "Herstel van leidingen of kranen als die ook onderhoud nodig hebben.",
  "service1_price": "€ 40 – € 80 per uur",
  "service1_url": "https://trustoo.nl/nederland/loodgieter/?utm_source=brevo&utm_campaign=crosssell_reminder_rioolservice&utm_medium=email&utm_content=kaart1",
  "service1_link_label": "Ontvang prijsindicatie",
  "service1_image_url": "https://img.mailinblue.com/9986607/images/rnb/original/6a99ca7aacfba11dfcf18786.jpg",
  "service1_image_alt": "Loodgieter aan het werk: leidingen aansluiten onder wastafel",
  "service2_name": "Vochtbestrijder",
  "service2_label": "Voor droge muren",
  "service2_text": "Hulp bij vochtproblemen als een lekkage sporen heeft achtergelaten.",
  "service2_price": "Prijs op maat",
  "service2_url": "https://trustoo.nl/nederland/vochtbestrijding/?utm_source=brevo&utm_campaign=crosssell_reminder_rioolservice&utm_medium=email&utm_content=kaart2",
  "service2_link_label": "Ontvang prijsindicatie",
  "service2_image_url": "https://img.mailinblue.com/9986607/images/rnb/original/6a99ca9bbe55c06bad68f884.jpg",
  "service2_image_alt": "Vochtbestrijder aan het werk: vochtmeting uitvoeren op muur",
  "service3_name": "Stratenmaker",
  "service3_label": "Voor terras, pad of oprit",
  "service3_text": "Herstel van bestrating als die voor rioolwerk is weggehaald.",
  "service3_price": "€ 40 – € 100 per m²",
  "service3_url": "https://trustoo.nl/nederland/stratenmaker/?utm_source=brevo&utm_campaign=crosssell_reminder_rioolservice&utm_medium=email&utm_content=kaart3",
  "service3_link_label": "Ontvang prijsindicatie",
  "service3_image_url": "https://img.mailinblue.com/9986607/images/rnb/original/6a99ca8d25aaba004d88df9b.jpg",
  "service3_image_alt": "Stratenmaker aan het werk: klinkers leggen",
  "service4_name": "Hovenier",
  "service4_label": "Voor je tuin",
  "service4_text": "Herstel van je tuin als er voor het rioolwerk is gegraven.",
  "service4_price": "€ 35 – € 65 per uur",
  "service4_url": "https://trustoo.nl/nederland/hovenier/?utm_source=brevo&utm_campaign=crosssell_reminder_rioolservice&utm_medium=email&utm_content=kaart4",
  "service4_link_label": "Ontvang prijsindicatie",
  "service4_image_url": "https://img.mailinblue.com/9986607/images/rnb/original/6a99ca73be55c06bad68f876.jpg",
  "service4_image_alt": "Hovenier aan het werk: planten en borders aanleggen",
  "prices_note": "Gemiddelde prijzen uit de kostengidsen op Trustoo. Wat jij betaalt, hangt af van je huis.",
  "closing_heading_pre": "Heb je al een rioolspecialist",
  "closing_heading_accent": "gevonden?",
  "closing_heading_post": "",
  "closing_intro": "Je aanvraag staat nog open. Heb je al iemand gevonden of heb je geen hulp meer nodig? Werk je aanvraag bij in Mijn aanvragen.",
  "all_services_label": "Alle diensten bekijken",
  "all_services_url": "https://trustoo.nl/?utm_source=brevo&utm_campaign=crosssell_reminder_rioolservice&utm_medium=email&utm_content=allediensten",
  "dashboard_label": "Mijn aanvraag bijwerken"
}
