{
  "title": "Naast een trapspecialist nog hulp nodig?",
  "subject_line": "Naast een trapspecialist nog hulp nodig?",
  "preheader": "Bekijk de gemiddelde kosten van een nieuwe vloer, een schilder of stoffering en vraag gratis een prijsindicatie op.",
  "hero_image_url": "https://img.mailinblue.com/9986607/images/rnb/original/6a99ca93be55c06bad68f87f.jpg",
  "hero_image_alt": "Traprenovatiebedrijf aan het werk: nieuwe traptreden monteren",
  "hero_title_pre": "Naast een trapspecialist nog",
  "hero_title_accent": "hulp",
  "hero_title_post": "nodig?",
  "hero_subtitle": "Je zocht onlangs via Trustoo een trapspecialist. Van een nieuwe vloer tot je interieur: dit is wat je nog meer voor je huis kunt laten doen.",
  "campaign_key": "crosssell_reminder_traprenovatie",
  "services_heading_pre": "Wat staat er nog op je",
  "services_heading_accent": "lijstje?",
  "services_heading_post": "",
  "services_intro": "Op Trustoo vergelijk je de beste bedrijven bij jou in de buurt voor wel 87 verschillende diensten. Vraag gratis en vrijblijvend offertes aan.",
  "grid_style": "",
  "stack_style": "display:none; mso-hide:all;",
  "stack2_style": "display:none; mso-hide:all;",
  "stack3_style": "display:none; mso-hide:all;",
  "service1_name": "Vloerlegger",
  "service1_label": "Voor een nieuwe vloer",
  "service1_text": "Toevallig ook een nieuwe vloer nodig? Laminaat, pvc of hout.",
  "service1_price": "€ 25 – € 75 per m²",
  "service1_url": "https://trustoo.nl/nederland/vloerlegger/?utm_source=brevo&utm_campaign=crosssell_reminder_traprenovatie&utm_medium=email&utm_content=kaart1",
  "service1_link_label": "Ontvang prijsindicatie",
  "service1_image_url": "https://img.mailinblue.com/9986607/images/rnb/original/6a99ca9a25aaba004d88dfa3.jpg",
  "service1_image_alt": "Vloerlegger aan het werk: houten vloerplanken leggen",
  "service2_name": "Schilder",
  "service2_label": "Voor binnen en buiten",
  "service2_text": "Schilderwerk voor het houtwerk en de muren rond je trap.",
  "service2_price": "€ 35 – € 50 per uur",
  "service2_url": "https://trustoo.nl/nederland/schilder/?utm_source=brevo&utm_campaign=crosssell_reminder_traprenovatie&utm_medium=email&utm_content=kaart2",
  "service2_link_label": "Ontvang prijsindicatie",
  "service2_image_url": "https://img.mailinblue.com/9986607/images/rnb/original/6a99ca89d6d15096d2e48aba.jpg",
  "service2_image_alt": "Schilder aan het werk: binnenmuur schilderen met roller",
  "service3_name": "Stoffeerder",
  "service3_label": "Voor stoffering",
  "service3_text": "Vloerbedekking voor een nieuwe uitstraling van je trap.",
  "service3_price": "Prijs op maat",
  "service3_url": "https://trustoo.nl/nederland/stoffeerder/?utm_source=brevo&utm_campaign=crosssell_reminder_traprenovatie&utm_medium=email&utm_content=kaart3",
  "service3_link_label": "Ontvang prijsindicatie",
  "service3_image_url": "https://img.mailinblue.com/9986607/images/rnb/original/6a99ca8c25aaba004d88df9a.jpg",
  "service3_image_alt": "Stoffeerder aan het werk: stoel opnieuw bekleden",
  "service4_name": "Interieurstylist",
  "service4_label": "Voor je interieur",
  "service4_text": "Interieuradvies over je trap en de rest van je inrichting.",
  "service4_price": "Prijs op maat",
  "service4_url": "https://trustoo.nl/nederland/interieurstylist/?utm_source=brevo&utm_campaign=crosssell_reminder_traprenovatie&utm_medium=email&utm_content=kaart4",
  "service4_link_label": "Ontvang prijsindicatie",
  "service4_image_url": "https://img.mailinblue.com/9986607/images/rnb/original/6a99ca76b423db7c1ead99b3.jpg",
  "service4_image_alt": "Interieurstylist aan het werk: materialen en kleuren presenteren",
  "prices_note": "Gemiddelde prijzen uit de kostengidsen op Trustoo. Wat jij betaalt, hangt af van je huis.",
  "closing_heading_pre": "Heb je al een trapspecialist",
  "closing_heading_accent": "gevonden?",
  "closing_heading_post": "",
  "closing_intro": "Je aanvraag staat nog open. Heb je al iemand gevonden of heb je geen hulp meer nodig? Werk je aanvraag bij in Mijn aanvragen.",
  "all_services_label": "Alle diensten bekijken",
  "all_services_url": "https://trustoo.nl/?utm_source=brevo&utm_campaign=crosssell_reminder_traprenovatie&utm_medium=email&utm_content=allediensten",
  "dashboard_label": "Mijn aanvraag bijwerken"
}
