{
  "title": "Naast een fotograaf nog hulp nodig?",
  "subject_line": "Naast een fotograaf nog hulp nodig?",
  "preheader": "Bekijk de gemiddelde kosten van een videograaf, een dj of een traiteur en vraag gratis een prijsindicatie op.",
  "hero_image_url": "https://img.mailinblue.com/9986607/images/rnb/original/6aaa43b0fd8ef40f6e584548.jpg",
  "hero_image_alt": "Fotograaf aan het werk: familieshoot in de studio",
  "hero_title_pre": "Naast een fotograaf nog",
  "hero_title_accent": "hulp",
  "hero_title_post": "nodig?",
  "hero_subtitle": "U zocht onlangs via Trustlocal een fotograaf. Organiseert u een feest of huwelijk? Dit is wat u daarvoor nog meer kunt regelen.",
  "campaign_key": "crosssell_reminder_fotograaf",
  "services_heading_pre": "Wat hebt u nog meer",
  "services_heading_accent": "nodig?",
  "services_heading_post": "",
  "services_intro": "Op Trustlocal vergelijkt u de beste bedrijven bij u in de buurt voor ruim 50 verschillende diensten. Vraag gratis en vrijblijvend een prijsindicatie aan.",
  "grid_style": "",
  "stack_style": "display:none; mso-hide:all;",
  "stack2_style": "display:none; mso-hide:all;",
  "stack3_style": "display:none; mso-hide:all;",
  "service1_name": "Videograaf",
  "service1_label": "Voor een film",
  "service1_text": "Een video als u de beelden ook in beweging wilt vastleggen.",
  "service1_price": "€ 100 – € 150 per uur",
  "service1_url": "https://trustlocal.be/belgie/videograaf/?utm_source=brevo&utm_campaign=crosssell_reminder_fotograaf&utm_medium=email&utm_content=kaart1",
  "service1_link_label": "Ontvang prijsindicatie",
  "service1_image_url": "https://img.mailinblue.com/9986607/images/rnb/original/6a99ca99be55c06bad68f882.jpg",
  "service1_image_alt": "Videograaf aan het werk: professionele camera bedienen",
  "service2_name": "Dj",
  "service2_label": "Voor de muziek",
  "service2_text": "Een feest op de planning? Muziek die past bij uw gasten.",
  "service2_price": "€ 100 – € 150 per uur",
  "service2_url": "https://trustlocal.be/belgie/dj/?utm_source=brevo&utm_campaign=crosssell_reminder_fotograaf&utm_medium=email&utm_content=kaart2",
  "service2_link_label": "Ontvang prijsindicatie",
  "service2_image_url": "https://img.mailinblue.com/9986607/images/rnb/original/6a99ca6125aaba004d88df8c.jpg",
  "service2_image_alt": "Dj aan het werk: draaitafel en apparatuur bedienen",
  "service3_name": "Traiteur",
  "service3_label": "Voor eten en drinken",
  "service3_text": "Een traiteur als u voor een feest eten en drinken zoekt.",
  "service3_price": "€ 25 – € 40 per persoon",
  "service3_url": "https://trustlocal.be/belgie/traiteur/?utm_source=brevo&utm_campaign=crosssell_reminder_fotograaf&utm_medium=email&utm_content=kaart3",
  "service3_link_label": "Ontvang prijsindicatie",
  "service3_image_url": "https://img.mailinblue.com/9986607/images/rnb/original/6a99ca5fb423db7c1ead99af.jpg",
  "service3_image_alt": "Traiteur aan het werk: gerechten voorbereiden voor evenement",
  "service4_name": "Huwelijksfotograaf",
  "service4_label": "Voor uw huwelijk",
  "service4_text": "Een fotograaf die uw huwelijksdag van begin tot eind vastlegt.",
  "service4_price": "€ 150 – € 200 per uur",
  "service4_url": "https://trustlocal.be/belgie/trouwfotograaf/?utm_source=brevo&utm_campaign=crosssell_reminder_fotograaf&utm_medium=email&utm_content=kaart4",
  "service4_link_label": "Ontvang prijsindicatie",
  "service4_image_url": "https://img.mailinblue.com/9986607/images/rnb/original/6a99ca94acfba11dfcf1878b.jpg",
  "service4_image_alt": "Huwelijksfotograaf aan het werk: bruidspaar spontaan fotograferen",
  "prices_note": "Gemiddelde prijzen op Trustlocal.be. Wat u betaalt, hangt af van uw feest.",
  "closing_heading_pre": "Hebt u al een fotograaf",
  "closing_heading_accent": "gevonden?",
  "closing_heading_post": "",
  "closing_intro": "Uw aanvraag staat nog open. Hebt u al iemand gevonden of hebt u geen hulp meer nodig? Werk uw aanvraag bij in Mijn aanvragen.",
  "all_services_label": "Alle diensten bekijken",
  "all_services_url": "https://trustlocal.be/alle-diensten/?utm_source=brevo&utm_campaign=crosssell_reminder_fotograaf&utm_medium=email&utm_content=allediensten",
  "dashboard_label": "Mijn aanvraag bijwerken"
}
