{
  "title": "Naast een incassobureau nog hulp nodig?",
  "subject_line": "Naast een incassobureau nog hulp nodig?",
  "preheader": "Bekijk de gemiddelde kosten van een advocaat of een accountant en vraag gratis een prijsindicatie op.",
  "hero_image_url": "https://img.mailinblue.com/9986607/images/rnb/original/6a99ca5425aaba004d88df88.jpg",
  "hero_image_alt": "Incassobureau nodig?",
  "hero_title_pre": "Naast een incassobureau nog",
  "hero_title_accent": "hulp",
  "hero_title_post": "nodig?",
  "hero_subtitle": "Je zocht onlangs via Trustoo een incassobureau. Van juridisch advies tot je jaarrekening: dit is wat je nog meer kunt uitbesteden.",
  "campaign_key": "crosssell_reminder_incassobureau",
  "services_heading_pre": "Wat staat er nog op je",
  "services_heading_accent": "lijstje?",
  "services_heading_post": "",
  "services_intro": "Op Trustoo vergelijk je de beste bedrijven bij jou in de buurt voor wel 87 verschillende diensten. Vraag gratis en vrijblijvend offertes aan.",
  "grid_style": "display:none; mso-hide:all;",
  "stack_style": "",
  "stack2_style": "",
  "stack3_style": "display:none; mso-hide:all;",
  "service1_name": "Advocaat",
  "service1_label": "Voor juridisch advies",
  "service1_text": "Juridisch advies als een onbetaalde rekening tot een conflict leidt.",
  "service1_price": "€ 250 – € 350 per uur",
  "service1_url": "https://trustoo.nl/nederland/advocaat/?utm_source=brevo&utm_campaign=crosssell_reminder_incassobureau&utm_medium=email&utm_content=kaart1",
  "service1_link_label": "Ontvang prijsindicatie",
  "service1_image_url": "https://img.mailinblue.com/9986607/images/rnb/original/6a99ca5425aaba004d88df88.jpg",
  "service1_image_alt": "Advocaat aan het werk: documenten bespreken met cliënt",
  "service2_name": "Accountant",
  "service2_label": "Voor je jaarrekening",
  "service2_text": "Hulp bij openstaande vorderingen in de jaarrekening van je bedrijf.",
  "service2_price": "€ 500 – € 1.250",
  "service2_url": "https://trustoo.nl/nederland/accountant/?utm_source=brevo&utm_campaign=crosssell_reminder_incassobureau&utm_medium=email&utm_content=kaart2",
  "service2_link_label": "Ontvang prijsindicatie",
  "service2_image_url": "https://img.mailinblue.com/9986607/images/rnb/original/6a99ca53acfba11dfcf1877e.jpg",
  "service2_image_alt": "Accountant aan het werk: financiële cijfers bespreken met klant",
  "service3_name": "",
  "service3_label": "",
  "service3_text": "",
  "service3_price": "",
  "service3_url": "",
  "service3_link_label": "",
  "service3_image_url": "",
  "service3_image_alt": "",
  "service4_name": "",
  "service4_label": "",
  "service4_text": "",
  "service4_price": "",
  "service4_url": "",
  "service4_link_label": "",
  "service4_image_url": "",
  "service4_image_alt": "",
  "prices_note": "Gemiddelde prijzen uit de kostengidsen op Trustoo. Wat jij betaalt, hangt af van je situatie.",
  "closing_heading_pre": "Heb je al een incassobureau",
  "closing_heading_accent": "gevonden?",
  "closing_heading_post": "",
  "closing_intro": "Je aanvraag staat nog open. Heb je al iemand gevonden of heb je geen hulp meer nodig? Werk je aanvraag bij in Mijn aanvragen.",
  "all_services_label": "Alle diensten bekijken",
  "all_services_url": "https://trustoo.nl/?utm_source=brevo&utm_campaign=crosssell_reminder_incassobureau&utm_medium=email&utm_content=allediensten",
  "dashboard_label": "Mijn aanvraag bijwerken"
}
