{
  "title": "Naast een notaris nog hulp nodig?",
  "subject_line": "Naast een notaris nog hulp nodig?",
  "preheader": "Bekijk de gemiddelde kosten van een makelaar, hypotheekadvies of een advocaat en vraag gratis een prijsindicatie op.",
  "hero_image_url": "https://img.mailinblue.com/9986607/images/rnb/original/6a99ca8025aaba004d88df94.jpg",
  "hero_image_alt": "Notaris aan het werk: akte bespreken met cliënten",
  "hero_title_pre": "Naast een notaris nog",
  "hero_title_accent": "hulp",
  "hero_title_post": "nodig?",
  "hero_subtitle": "Je zocht onlangs via Trustoo een notaris. Van een makelaar tot je verhuizing: dit is wat je nog meer kunt regelen.",
  "campaign_key": "crosssell_reminder_notaris",
  "services_heading_pre": "Wat moet je nog meer",
  "services_heading_accent": "regelen?",
  "services_heading_post": "",
  "services_intro": "Op Trustoo vergelijk je de beste bedrijven bij jou in de buurt voor wel 87 verschillende diensten. Vraag gratis en vrijblijvend offertes aan.",
  "grid_style": "",
  "stack_style": "display:none; mso-hide:all;",
  "stack2_style": "display:none; mso-hide:all;",
  "stack3_style": "display:none; mso-hide:all;",
  "service1_name": "Makelaar",
  "service1_label": "Voor kopen of verkopen",
  "service1_text": "Begeleiding van een makelaar als je een woning koopt of verkoopt.",
  "service1_price": "Vast: € 2.500 – € 7.500",
  "service1_url": "https://trustoo.nl/nederland/makelaar/?utm_source=brevo&utm_campaign=crosssell_reminder_notaris&utm_medium=email&utm_content=kaart1",
  "service1_link_label": "Ontvang prijsindicatie",
  "service1_image_url": "https://img.mailinblue.com/9986607/images/rnb/original/6a99ca7cd6d15096d2e48ab7.jpg",
  "service1_image_alt": "Makelaar aan het werk: woning rondleiden aan geïnteresseerden",
  "service2_name": "Hypotheekadviseur",
  "service2_label": "Voor je financiering",
  "service2_text": "Hypotheekadvies als je voor de aankoop een hypotheek nodig hebt.",
  "service2_price": "€ 2.000 – € 3.000",
  "service2_url": "https://trustoo.nl/nederland/hypotheekadviseur/?utm_source=brevo&utm_campaign=crosssell_reminder_notaris&utm_medium=email&utm_content=kaart2",
  "service2_link_label": "Ontvang prijsindicatie",
  "service2_image_url": "https://img.mailinblue.com/9986607/images/rnb/original/6a99ca75d6d15096d2e48ab5.jpg",
  "service2_image_alt": "Hypotheekadviseur aan het werk: hypotheekopties bespreken met stel",
  "service3_name": "Advocaat",
  "service3_label": "Voor juridisch advies",
  "service3_text": "Juridisch advies bij vragen over een conflict of overeenkomst.",
  "service3_price": "€ 250 – € 350 per uur",
  "service3_url": "https://trustoo.nl/nederland/advocaat/?utm_source=brevo&utm_campaign=crosssell_reminder_notaris&utm_medium=email&utm_content=kaart3",
  "service3_link_label": "Ontvang prijsindicatie",
  "service3_image_url": "https://img.mailinblue.com/9986607/images/rnb/original/6a99ca5425aaba004d88df88.jpg",
  "service3_image_alt": "Advocaat aan het werk: documenten bespreken met cliënt",
  "service4_name": "Verhuisbedrijf",
  "service4_label": "Voor je verhuizing",
  "service4_text": "Hulp bij je verhuizing als je naar een andere woning gaat.",
  "service4_price": "€ 500 – € 1.500",
  "service4_url": "https://trustoo.nl/nederland/verhuisbedrijf/?utm_source=brevo&utm_campaign=crosssell_reminder_notaris&utm_medium=email&utm_content=kaart4",
  "service4_link_label": "Ontvang prijsindicatie",
  "service4_image_url": "https://img.mailinblue.com/9986607/images/rnb/original/6a99ca96d6d15096d2e48abb.jpg",
  "service4_image_alt": "Verhuizer aan het werk: verhuisdoos zorgvuldig naar bus dragen",
  "prices_note": "Gemiddelde prijzen uit de kostengidsen op Trustoo. Wat jij betaalt, hangt af van je situatie.",
  "closing_heading_pre": "Heb je al een notaris",
  "closing_heading_accent": "gevonden?",
  "closing_heading_post": "",
  "closing_intro": "Je aanvraag staat nog open. Heb je al iemand gevonden of heb je geen hulp meer nodig? Werk je aanvraag bij in Mijn aanvragen.",
  "all_services_label": "Alle diensten bekijken",
  "all_services_url": "https://trustoo.nl/?utm_source=brevo&utm_campaign=crosssell_reminder_notaris&utm_medium=email&utm_content=allediensten",
  "dashboard_label": "Mijn aanvraag bijwerken"
}
