{
  "title": "Naast een klusjesman nog hulp nodig?",
  "subject_line": "Naast een klusjesman nog hulp nodig?",
  "preheader": "Bekijk de gemiddelde kosten van een schilder, een loodgieter of een elektricien en vraag gratis een prijsindicatie op.",
  "hero_image_url": "https://img.mailinblue.com/9986607/images/rnb/original/6a99ca7825aaba004d88df93.jpg",
  "hero_image_alt": "Klusjesman aan het werk: kast of plank monteren",
  "hero_title_pre": "Naast een klusjesman nog",
  "hero_title_accent": "hulp",
  "hero_title_post": "nodig?",
  "hero_subtitle": "Je zocht onlangs via Trustoo een klusjesman. Van schilderwerk tot maatmeubels: dit is wat je nog meer voor je huis kunt laten doen.",
  "campaign_key": "crosssell_reminder_klusjesman",
  "services_heading_pre": "Wat staat er nog op je",
  "services_heading_accent": "lijstje?",
  "services_heading_post": "",
  "services_intro": "Op Trustoo vergelijk je de beste bedrijven bij jou in de buurt voor wel 87 verschillende diensten. Vraag gratis en vrijblijvend offertes aan.",
  "grid_style": "",
  "stack_style": "display:none; mso-hide:all;",
  "stack2_style": "display:none; mso-hide:all;",
  "stack3_style": "display:none; mso-hide:all;",
  "service1_name": "Schilder",
  "service1_label": "Voor binnen en buiten",
  "service1_text": "Schilderwerk als je ook muren of houtwerk wilt laten afwerken.",
  "service1_price": "€ 35 – € 50 per uur",
  "service1_url": "https://trustoo.nl/nederland/schilder/?utm_source=brevo&utm_campaign=crosssell_reminder_klusjesman&utm_medium=email&utm_content=kaart1",
  "service1_link_label": "Ontvang prijsindicatie",
  "service1_image_url": "https://img.mailinblue.com/9986607/images/rnb/original/6a99ca89d6d15096d2e48aba.jpg",
  "service1_image_alt": "Schilder aan het werk: binnenmuur schilderen met roller",
  "service2_name": "Loodgieter",
  "service2_label": "Voor water en afvoer",
  "service2_text": "Hulp bij het verleggen of vervangen van leidingen en kranen.",
  "service2_price": "€ 40 – € 80 per uur",
  "service2_url": "https://trustoo.nl/nederland/loodgieter/?utm_source=brevo&utm_campaign=crosssell_reminder_klusjesman&utm_medium=email&utm_content=kaart2",
  "service2_link_label": "Ontvang prijsindicatie",
  "service2_image_url": "https://img.mailinblue.com/9986607/images/rnb/original/6a99ca7aacfba11dfcf18786.jpg",
  "service2_image_alt": "Loodgieter aan het werk: leidingen aansluiten onder wastafel",
  "service3_name": "Elektricien",
  "service3_label": "Voor veilige elektra",
  "service3_text": "Elektra als je stopcontacten of verlichting wilt laten aanpassen.",
  "service3_price": "€ 35 – € 70 per uur",
  "service3_url": "https://trustoo.nl/nederland/elektricien/?utm_source=brevo&utm_campaign=crosssell_reminder_klusjesman&utm_medium=email&utm_content=kaart3",
  "service3_link_label": "Ontvang prijsindicatie",
  "service3_image_url": "https://img.mailinblue.com/9986607/images/rnb/original/6a99ca6525aaba004d88df8d.jpg",
  "service3_image_alt": "Elektricien aan het werk: stopcontact of groepenkast aansluiten",
  "service4_name": "Meubelmaker",
  "service4_label": "Voor maatmeubels",
  "service4_text": "Een meubel op maat voor de ruimte die je verder wilt inrichten.",
  "service4_price": "Prijs op maat",
  "service4_url": "https://trustoo.nl/nederland/meubelmaker/?utm_source=brevo&utm_campaign=crosssell_reminder_klusjesman&utm_medium=email&utm_content=kaart4",
  "service4_link_label": "Ontvang prijsindicatie",
  "service4_image_url": "https://img.mailinblue.com/9986607/images/rnb/original/6a99ca7fb423db7c1ead99b6.jpg",
  "service4_image_alt": "Meubelmaker aan het werk: houten meubel afwerken",
  "prices_note": "Gemiddelde prijzen uit de kostengidsen op Trustoo. Wat jij betaalt, hangt af van je huis.",
  "closing_heading_pre": "Heb je al een klusjesman",
  "closing_heading_accent": "gevonden?",
  "closing_heading_post": "",
  "closing_intro": "Je aanvraag staat nog open. Heb je al iemand gevonden of heb je geen hulp meer nodig? Werk je aanvraag bij in Mijn aanvragen.",
  "all_services_label": "Alle diensten bekijken",
  "all_services_url": "https://trustoo.nl/?utm_source=brevo&utm_campaign=crosssell_reminder_klusjesman&utm_medium=email&utm_content=allediensten",
  "dashboard_label": "Mijn aanvraag bijwerken"
}
