{
  "title": "Naast schoonmaak nog hulp nodig?",
  "subject_line": "Naast schoonmaak nog hulp nodig?",
  "preheader": "Bekijk de gemiddelde kosten van een verhuisfirma, tuinonderhoud of een glazenwasser en vraag gratis een prijsindicatie op.",
  "hero_image_url": "https://img.mailinblue.com/9986607/images/rnb/original/6a99ca84d6d15096d2e48ab9.jpg",
  "hero_image_alt": "Professionele schoonmaker aan het werk: keukenoppervlak grondig reinigen",
  "hero_title_pre": "Naast schoonmaak nog",
  "hero_title_accent": "hulp",
  "hero_title_post": "nodig?",
  "hero_subtitle": "U zocht onlangs via Trustlocal een schoonmaakbedrijf. Van uw verhuizing tot heldere ramen: dit is wat u nog meer voor uw huis kunt laten doen.",
  "campaign_key": "crosssell_reminder_schoonmaakbedrijf",
  "services_heading_pre": "Wat staat er nog op uw",
  "services_heading_accent": "lijstje?",
  "services_heading_post": "",
  "services_intro": "Op Trustlocal vergelijkt u de beste bedrijven bij u in de buurt voor ruim 50 verschillende diensten. Vraag gratis en vrijblijvend een prijsindicatie aan.",
  "grid_style": "",
  "stack_style": "display:none; mso-hide:all;",
  "stack2_style": "display:none; mso-hide:all;",
  "stack3_style": "display:none; mso-hide:all;",
  "service1_name": "Verhuisfirma",
  "service1_label": "Voor uw verhuizing",
  "service1_text": "Een verhuisfirma als de schoonmaak deel is van een verhuizing.",
  "service1_price": "€ 60 – € 80 per uur",
  "service1_url": "https://trustlocal.be/belgie/verhuisfirma/?utm_source=brevo&utm_campaign=crosssell_reminder_schoonmaakbedrijf&utm_medium=email&utm_content=kaart1",
  "service1_link_label": "Ontvang prijsindicatie",
  "service1_image_url": "https://img.mailinblue.com/9986607/images/rnb/original/6a99ca96d6d15096d2e48abb.jpg",
  "service1_image_alt": "Medewerker van een verhuisfirma aan het werk: verhuisdoos zorgvuldig naar bus dragen",
  "service2_name": "Tuinonderhoudbedrijf",
  "service2_label": "Voor uw tuin",
  "service2_text": "Tuinonderhoud, zodat ook buiten alles verzorgd is.",
  "service2_price": "€ 35 – € 50 per uur",
  "service2_url": "https://trustlocal.be/belgie/tuinaanleg-en-tuinonderhoud/?utm_source=brevo&utm_campaign=crosssell_reminder_schoonmaakbedrijf&utm_medium=email&utm_content=kaart2",
  "service2_link_label": "Ontvang prijsindicatie",
  "service2_image_url": "https://img.mailinblue.com/9986607/images/rnb/original/6a99ca73be55c06bad68f876.jpg",
  "service2_image_alt": "Tuinonderhoudbedrijf aan het werk: planten en borders aanleggen",
  "service3_name": "Glazenwasser",
  "service3_label": "Voor heldere ramen",
  "service3_text": "Ramen binnen en buiten gewassen, eenmalig of op vaste momenten.",
  "service3_price": "€ 40 – € 50 per uur",
  "service3_url": "https://trustlocal.be/belgie/glazenwasser/?utm_source=brevo&utm_campaign=crosssell_reminder_schoonmaakbedrijf&utm_medium=email&utm_content=kaart3",
  "service3_link_label": "Ontvang prijsindicatie",
  "service3_image_url": "https://img.mailinblue.com/9986607/images/rnb/original/6a99ca71be55c06bad68f875.jpg",
  "service3_image_alt": "Glazenwasser aan het werk: ramen reinigen aan de buitenkant",
  "service4_name": "Schilder",
  "service4_label": "Voor binnen en buiten",
  "service4_text": "Een frisse laag verf als u uw woning ook wilt opfrissen.",
  "service4_price": "€ 35 – € 45 per uur",
  "service4_url": "https://trustlocal.be/belgie/schilder/?utm_source=brevo&utm_campaign=crosssell_reminder_schoonmaakbedrijf&utm_medium=email&utm_content=kaart4",
  "service4_link_label": "Ontvang prijsindicatie",
  "service4_image_url": "https://img.mailinblue.com/9986607/images/rnb/original/6aaa43aa0b0c510d795d8951.jpg",
  "service4_image_alt": "Schilder aan het werk: binnenmuur schilderen met een verfroller",
  "prices_note": "Gemiddelde prijzen op Trustlocal.be. Wat u betaalt, hangt af van uw woning.",
  "closing_heading_pre": "Hebt u al een schoonmaakbedrijf",
  "closing_heading_accent": "gevonden?",
  "closing_heading_post": "",
  "closing_intro": "Uw aanvraag staat nog open. Hebt u al iemand gevonden of hebt u geen hulp meer nodig? Werk uw aanvraag bij in Mijn aanvragen.",
  "all_services_label": "Alle diensten bekijken",
  "all_services_url": "https://trustlocal.be/alle-diensten/?utm_source=brevo&utm_campaign=crosssell_reminder_schoonmaakbedrijf&utm_medium=email&utm_content=allediensten",
  "dashboard_label": "Mijn aanvraag bijwerken"
}
