{
  "title": "Naast een stoffeerder nog hulp nodig?",
  "subject_line": "Naast een stoffeerder nog hulp nodig?",
  "preheader": "Bekijk de gemiddelde kosten van een nieuwe vloer, interieurstyling of schoonmaak en vraag gratis een prijsindicatie op.",
  "hero_image_url": "https://img.mailinblue.com/9986607/images/rnb/original/6a99ca8c25aaba004d88df9a.jpg",
  "hero_image_alt": "Stoffeerder aan het werk: stoel opnieuw bekleden",
  "hero_title_pre": "Naast een stoffeerder nog",
  "hero_title_accent": "hulp",
  "hero_title_post": "nodig?",
  "hero_subtitle": "Je zocht onlangs via Trustoo een stoffeerder. Van een nieuwe vloer tot maatmeubels: dit is wat je nog meer voor je huis kunt laten doen.",
  "campaign_key": "crosssell_reminder_stoffeerder",
  "services_heading_pre": "Wat staat er nog op je",
  "services_heading_accent": "lijstje?",
  "services_heading_post": "",
  "services_intro": "Op Trustoo vergelijk je de beste bedrijven bij jou in de buurt voor wel 87 verschillende diensten. Vraag gratis en vrijblijvend offertes aan.",
  "grid_style": "",
  "stack_style": "display:none; mso-hide:all;",
  "stack2_style": "display:none; mso-hide:all;",
  "stack3_style": "display:none; mso-hide:all;",
  "service1_name": "Vloerlegger",
  "service1_label": "Voor een nieuwe vloer",
  "service1_text": "Toevallig ook een nieuwe vloer nodig? Laminaat, pvc of hout.",
  "service1_price": "€ 25 – € 75 per m²",
  "service1_url": "https://trustoo.nl/nederland/vloerlegger/?utm_source=brevo&utm_campaign=crosssell_reminder_stoffeerder&utm_medium=email&utm_content=kaart1",
  "service1_link_label": "Ontvang prijsindicatie",
  "service1_image_url": "https://img.mailinblue.com/9986607/images/rnb/original/6a99ca9a25aaba004d88dfa3.jpg",
  "service1_image_alt": "Vloerlegger aan het werk: houten vloerplanken leggen",
  "service2_name": "Interieurstylist",
  "service2_label": "Voor je interieur",
  "service2_text": "Advies over kleuren en materialen die aansluiten op je stoffering.",
  "service2_price": "Prijs op maat",
  "service2_url": "https://trustoo.nl/nederland/interieurstylist/?utm_source=brevo&utm_campaign=crosssell_reminder_stoffeerder&utm_medium=email&utm_content=kaart2",
  "service2_link_label": "Ontvang prijsindicatie",
  "service2_image_url": "https://img.mailinblue.com/9986607/images/rnb/original/6a99ca76b423db7c1ead99b3.jpg",
  "service2_image_alt": "Interieurstylist aan het werk: materialen en kleuren presenteren",
  "service3_name": "Schoonmaakbedrijf",
  "service3_label": "Voor een schoon huis",
  "service3_text": "Een grondige schoonmaak als het werk in huis klaar is.",
  "service3_price": "€ 20 – € 30 per uur",
  "service3_url": "https://trustoo.nl/nederland/schoonmaakbedrijf/?utm_source=brevo&utm_campaign=crosssell_reminder_stoffeerder&utm_medium=email&utm_content=kaart3",
  "service3_link_label": "Ontvang prijsindicatie",
  "service3_image_url": "https://img.mailinblue.com/9986607/images/rnb/original/6a99ca84d6d15096d2e48ab9.jpg",
  "service3_image_alt": "Professionele schoonmaker aan het werk: keukenoppervlak grondig reinigen",
  "service4_name": "Meubelmaker",
  "service4_label": "Voor maatmeubels",
  "service4_text": "Toevallig ook een kast, tafel of ander meubel op maat nodig?",
  "service4_price": "Prijs op maat",
  "service4_url": "https://trustoo.nl/nederland/meubelmaker/?utm_source=brevo&utm_campaign=crosssell_reminder_stoffeerder&utm_medium=email&utm_content=kaart4",
  "service4_link_label": "Ontvang prijsindicatie",
  "service4_image_url": "https://img.mailinblue.com/9986607/images/rnb/original/6a99ca7fb423db7c1ead99b6.jpg",
  "service4_image_alt": "Meubelmaker aan het werk: houten meubel afwerken",
  "prices_note": "Gemiddelde prijzen uit de kostengidsen op Trustoo. Wat jij betaalt, hangt af van je huis.",
  "closing_heading_pre": "Heb je al een stoffeerder",
  "closing_heading_accent": "gevonden?",
  "closing_heading_post": "",
  "closing_intro": "Je aanvraag staat nog open. Heb je al iemand gevonden of heb je geen hulp meer nodig? Werk je aanvraag bij in Mijn aanvragen.",
  "all_services_label": "Alle diensten bekijken",
  "all_services_url": "https://trustoo.nl/?utm_source=brevo&utm_campaign=crosssell_reminder_stoffeerder&utm_medium=email&utm_content=allediensten",
  "dashboard_label": "Mijn aanvraag bijwerken"
}
