{
  "title": "Naast een glaszetter nog hulp nodig?",
  "subject_line": "Naast een glaszetter nog hulp nodig?",
  "preheader": "Bekijk de gemiddelde kosten van kozijnen, een schilder of zonwering en vraag gratis een prijsindicatie op.",
  "hero_image_url": "https://img.mailinblue.com/9986607/images/rnb/original/6a99ca70be55c06bad68f874.jpg",
  "hero_image_alt": "Glaszetter aan het werk: nieuwe ruit in kozijn plaatsen",
  "hero_title_pre": "Naast een glaszetter nog",
  "hero_title_accent": "hulp",
  "hero_title_post": "nodig?",
  "hero_subtitle": "Je zocht onlangs via Trustoo een glaszetter. Van kozijnen tot isolatie: dit is wat er nog meer bij nieuwe ramen komt kijken.",
  "campaign_key": "crosssell_reminder_glaszetter",
  "services_heading_pre": "Wat staat er nog op je",
  "services_heading_accent": "lijstje?",
  "services_heading_post": "",
  "services_intro": "Op Trustoo vergelijk je de beste bedrijven bij jou in de buurt voor wel 87 verschillende diensten. Vraag gratis en vrijblijvend offertes aan.",
  "grid_style": "",
  "stack_style": "display:none; mso-hide:all;",
  "stack2_style": "display:none; mso-hide:all;",
  "stack3_style": "display:none; mso-hide:all;",
  "service1_name": "Kozijnspecialist",
  "service1_label": "Voor nieuwe kozijnen",
  "service1_text": "Nieuwe kozijnen als je ook de omlijsting van je glas wilt vervangen.",
  "service1_price": "€ 800 – € 1.500 per stuk",
  "service1_url": "https://trustoo.nl/nederland/kozijnen/?utm_source=brevo&utm_campaign=crosssell_reminder_glaszetter&utm_medium=email&utm_content=kaart1",
  "service1_link_label": "Ontvang prijsindicatie",
  "service1_image_url": "https://img.mailinblue.com/9986607/images/rnb/original/6a99ca79acfba11dfcf18785.jpg",
  "service1_image_alt": "Kozijnspecialist aan het werk: nieuw kozijn monteren",
  "service2_name": "Schilder",
  "service2_label": "Voor binnen en buiten",
  "service2_text": "Schilderwerk voor een nette afwerking rondom je nieuwe ramen.",
  "service2_price": "€ 35 – € 50 per uur",
  "service2_url": "https://trustoo.nl/nederland/schilder/?utm_source=brevo&utm_campaign=crosssell_reminder_glaszetter&utm_medium=email&utm_content=kaart2",
  "service2_link_label": "Ontvang prijsindicatie",
  "service2_image_url": "https://img.mailinblue.com/9986607/images/rnb/original/6a99ca89d6d15096d2e48aba.jpg",
  "service2_image_alt": "Schilder aan het werk: binnenmuur schilderen met roller",
  "service3_name": "Zonweringspecialist",
  "service3_label": "Voor koelte en privacy",
  "service3_text": "Zonwering die aansluit op je ramen en helpt om de zon te weren.",
  "service3_price": "€ 500 – € 3.000",
  "service3_url": "https://trustoo.nl/nederland/zonwering/?utm_source=brevo&utm_campaign=crosssell_reminder_glaszetter&utm_medium=email&utm_content=kaart3",
  "service3_link_label": "Ontvang prijsindicatie",
  "service3_image_url": "https://img.mailinblue.com/9986607/images/rnb/original/6a99caa025aaba004d88dfa4.jpg",
  "service3_image_alt": "Zonweringsmonteur aan het werk: elektrisch zonnescherm installeren",
  "service4_name": "Isolatiebedrijf",
  "service4_label": "Voor warmte binnen",
  "service4_text": "Advies over andere plekken in je woning waar isolatie kan helpen.",
  "service4_price": "€ 25 – € 65 per m²",
  "service4_url": "https://trustoo.nl/nederland/isolatie/?utm_source=brevo&utm_campaign=crosssell_reminder_glaszetter&utm_medium=email&utm_content=kaart4",
  "service4_link_label": "Ontvang prijsindicatie",
  "service4_image_url": "https://img.mailinblue.com/9986607/images/rnb/original/6a99ca7725aaba004d88df92.jpg",
  "service4_image_alt": "Isolatiespecialist aan het werk: isolatiemateriaal aanbrengen",
  "prices_note": "Gemiddelde prijzen uit de kostengidsen op Trustoo. Wat jij betaalt, hangt af van je ramen.",
  "closing_heading_pre": "Heb je al een glaszetter",
  "closing_heading_accent": "gevonden?",
  "closing_heading_post": "",
  "closing_intro": "Je aanvraag staat nog open. Heb je al iemand gevonden of heb je geen hulp meer nodig? Werk je aanvraag bij in Mijn aanvragen.",
  "all_services_label": "Alle diensten bekijken",
  "all_services_url": "https://trustoo.nl/?utm_source=brevo&utm_campaign=crosssell_reminder_glaszetter&utm_medium=email&utm_content=allediensten",
  "dashboard_label": "Mijn aanvraag bijwerken"
}
