{
  "title": "Naast een stukadoor nog hulp nodig?",
  "subject_line": "Naast een stukadoor nog hulp nodig?",
  "preheader": "Bekijk de gemiddelde kosten van een schilder, een aannemer of een elektricien en vraag gratis een prijsindicatie op.",
  "hero_image_url": "https://img.mailinblue.com/9986607/images/rnb/original/6a99ca8db423db7c1ead99ba.jpg",
  "hero_image_alt": "Stukadoor aan het werk: wand glad stucen",
  "hero_title_pre": "Naast een stukadoor nog",
  "hero_title_accent": "hulp",
  "hero_title_post": "nodig?",
  "hero_subtitle": "Je zocht onlangs via Trustoo een stukadoor. Van schilderwerk tot een nieuwe vloer: dit is wat je nog meer voor je huis kunt laten doen.",
  "campaign_key": "crosssell_reminder_stukadoor",
  "services_heading_pre": "Wat staat er nog op je",
  "services_heading_accent": "lijstje?",
  "services_heading_post": "",
  "services_intro": "Op Trustoo vergelijk je de beste bedrijven bij jou in de buurt voor wel 87 verschillende diensten. Vraag gratis en vrijblijvend offertes aan.",
  "grid_style": "",
  "stack_style": "display:none; mso-hide:all;",
  "stack2_style": "display:none; mso-hide:all;",
  "stack3_style": "display:none; mso-hide:all;",
  "service1_name": "Schilder",
  "service1_label": "Voor binnen en buiten",
  "service1_text": "Schilderwerk voor je gestucte muren zodra die voldoende droog zijn.",
  "service1_price": "€ 35 – € 50 per uur",
  "service1_url": "https://trustoo.nl/nederland/schilder/?utm_source=brevo&utm_campaign=crosssell_reminder_stukadoor&utm_medium=email&utm_content=kaart1",
  "service1_link_label": "Ontvang prijsindicatie",
  "service1_image_url": "https://img.mailinblue.com/9986607/images/rnb/original/6a99ca89d6d15096d2e48aba.jpg",
  "service1_image_alt": "Schilder aan het werk: binnenmuur schilderen met roller",
  "service2_name": "Aannemer",
  "service2_label": "Voor bouwen en verbouwen",
  "service2_text": "Een aannemer als het stucwerk deel is van een verbouwing.",
  "service2_price": "€ 35 – € 60 per uur",
  "service2_url": "https://trustoo.nl/nederland/aannemer/?utm_source=brevo&utm_campaign=crosssell_reminder_stukadoor&utm_medium=email&utm_content=kaart2",
  "service2_link_label": "Ontvang prijsindicatie",
  "service2_image_url": "https://img.mailinblue.com/9986607/images/rnb/original/6a99ca53be55c06bad68f86a.jpg",
  "service2_image_alt": "Aannemer aan het werk: bouwtekening bekijken tijdens renovatie",
  "service3_name": "Elektricien",
  "service3_label": "Voor veilige elektra",
  "service3_text": "Nieuwe stopcontacten of leidingen voordat je muren worden gestuct.",
  "service3_price": "€ 35 – € 70 per uur",
  "service3_url": "https://trustoo.nl/nederland/elektricien/?utm_source=brevo&utm_campaign=crosssell_reminder_stukadoor&utm_medium=email&utm_content=kaart3",
  "service3_link_label": "Ontvang prijsindicatie",
  "service3_image_url": "https://img.mailinblue.com/9986607/images/rnb/original/6a99ca6525aaba004d88df8d.jpg",
  "service3_image_alt": "Elektricien aan het werk: stopcontact of groepenkast aansluiten",
  "service4_name": "Vloerlegger",
  "service4_label": "Voor een nieuwe vloer",
  "service4_text": "Een nieuwe vloer als je naast stucwerk ook de vloer wilt vernieuwen.",
  "service4_price": "€ 25 – € 75 per m²",
  "service4_url": "https://trustoo.nl/nederland/vloerlegger/?utm_source=brevo&utm_campaign=crosssell_reminder_stukadoor&utm_medium=email&utm_content=kaart4",
  "service4_link_label": "Ontvang prijsindicatie",
  "service4_image_url": "https://img.mailinblue.com/9986607/images/rnb/original/6a99ca9a25aaba004d88dfa3.jpg",
  "service4_image_alt": "Vloerlegger aan het werk: houten vloerplanken leggen",
  "prices_note": "Gemiddelde prijzen uit de kostengidsen op Trustoo. Wat jij betaalt, hangt af van je huis.",
  "closing_heading_pre": "Heb je al een stukadoor",
  "closing_heading_accent": "gevonden?",
  "closing_heading_post": "",
  "closing_intro": "Je aanvraag staat nog open. Heb je al iemand gevonden of heb je geen hulp meer nodig? Werk je aanvraag bij in Mijn aanvragen.",
  "all_services_label": "Alle diensten bekijken",
  "all_services_url": "https://trustoo.nl/?utm_source=brevo&utm_campaign=crosssell_reminder_stukadoor&utm_medium=email&utm_content=allediensten",
  "dashboard_label": "Mijn aanvraag bijwerken"
}
