{
  "title": "Naast een fotograaf nog hulp nodig?",
  "subject_line": "Naast een fotograaf nog hulp nodig?",
  "preheader": "Bekijk de gemiddelde kosten van een videograaf, een dj of catering en vraag gratis een prijsindicatie op.",
  "hero_image_url": "https://img.mailinblue.com/9986607/images/rnb/original/6a99ca6db423db7c1ead99b2.jpg",
  "hero_image_alt": "Fotograaf aan het werk: portret fotograferen op locatie",
  "hero_title_pre": "Naast een fotograaf nog",
  "hero_title_accent": "hulp",
  "hero_title_post": "nodig?",
  "hero_subtitle": "Je zocht onlangs via Trustoo een fotograaf. Organiseer je een feest of bruiloft? Dit is wat je daarvoor nog meer kunt regelen.",
  "campaign_key": "crosssell_reminder_fotograaf",
  "services_heading_pre": "Wat heb je nog meer",
  "services_heading_accent": "nodig?",
  "services_heading_post": "",
  "services_intro": "Op Trustoo vergelijk je de beste bedrijven bij jou in de buurt voor wel 87 verschillende diensten. Vraag gratis en vrijblijvend offertes aan.",
  "grid_style": "",
  "stack_style": "display:none; mso-hide:all;",
  "stack2_style": "display:none; mso-hide:all;",
  "stack3_style": "display:none; mso-hide:all;",
  "service1_name": "Videograaf",
  "service1_label": "Voor een film",
  "service1_text": "Een video als je de beelden ook in beweging wilt vastleggen.",
  "service1_price": "Prijs op maat",
  "service1_url": "https://trustoo.nl/nederland/videograaf/?utm_source=brevo&utm_campaign=crosssell_reminder_fotograaf&utm_medium=email&utm_content=kaart1",
  "service1_link_label": "Ontvang prijsindicatie",
  "service1_image_url": "https://img.mailinblue.com/9986607/images/rnb/original/6a99ca99be55c06bad68f882.jpg",
  "service1_image_alt": "Videograaf aan het werk: professionele camera bedienen",
  "service2_name": "DJ",
  "service2_label": "Voor de muziek",
  "service2_text": "Een feest op de planning? Muziek die past bij je gasten.",
  "service2_price": "€ 125 – € 200 per uur",
  "service2_url": "https://trustoo.nl/nederland/dj/?utm_source=brevo&utm_campaign=crosssell_reminder_fotograaf&utm_medium=email&utm_content=kaart2",
  "service2_link_label": "Ontvang prijsindicatie",
  "service2_image_url": "https://img.mailinblue.com/9986607/images/rnb/original/6a99ca6125aaba004d88df8c.jpg",
  "service2_image_alt": "dj aan het werk: draaitafel en apparatuur bedienen",
  "service3_name": "Cateraar",
  "service3_label": "Voor eten en drinken",
  "service3_text": "Catering als je voor een bijeenkomst eten en drinken zoekt.",
  "service3_price": "€ 15,50 – € 22 p.p.",
  "service3_url": "https://trustoo.nl/nederland/catering/?utm_source=brevo&utm_campaign=crosssell_reminder_fotograaf&utm_medium=email&utm_content=kaart3",
  "service3_link_label": "Ontvang prijsindicatie",
  "service3_image_url": "https://img.mailinblue.com/9986607/images/rnb/original/6a99ca5fb423db7c1ead99af.jpg",
  "service3_image_alt": "Cateraar aan het werk: gerechten voorbereiden voor evenement",
  "service4_name": "Weddingplanner",
  "service4_label": "Voor de planning",
  "service4_text": "Ga je trouwen? Hulp bij de planning van jullie bruiloft.",
  "service4_price": "€ 3.000 – € 5.000",
  "service4_url": "https://trustoo.nl/nederland/weddingplanner/?utm_source=brevo&utm_campaign=crosssell_reminder_fotograaf&utm_medium=email&utm_content=kaart4",
  "service4_link_label": "Ontvang prijsindicatie",
  "service4_image_url": "https://img.mailinblue.com/9986607/images/rnb/original/6a99ca9db423db7c1ead99bf.jpg",
  "service4_image_alt": "Weddingplanner aan het werk: tafeldecoratie en draaiboek controleren",
  "prices_note": "Gemiddelde prijzen uit de kostengidsen op Trustoo. Wat jij betaalt, hangt af van je feest.",
  "closing_heading_pre": "Heb je al een fotograaf",
  "closing_heading_accent": "gevonden?",
  "closing_heading_post": "",
  "closing_intro": "Je aanvraag staat nog open. Heb je al iemand gevonden of heb je geen hulp meer nodig? Werk je aanvraag bij in Mijn aanvragen.",
  "all_services_label": "Alle diensten bekijken",
  "all_services_url": "https://trustoo.nl/?utm_source=brevo&utm_campaign=crosssell_reminder_fotograaf&utm_medium=email&utm_content=allediensten",
  "dashboard_label": "Mijn aanvraag bijwerken"
}
