{
  "title": "Naast personal training nog hulp nodig?",
  "subject_line": "Naast personal training nog hulp nodig?",
  "preheader": "Bekijk de gemiddelde kosten van coaching, een psycholoog of relatietherapie en vraag gratis een prijsindicatie op.",
  "hero_image_url": "https://img.mailinblue.com/9986607/images/rnb/original/6aaa43affd8ef40f6e584547.jpg",
  "hero_image_alt": "Personal trainer aan het werk: klant begeleiden bij krachttraining",
  "hero_title_pre": "Naast personal training nog",
  "hero_title_accent": "hulp",
  "hero_title_post": "nodig?",
  "hero_subtitle": "U zocht onlangs via Trustlocal een personal trainer. Van coaching tot een luisterend oor: misschien hebt u hier ook iets aan.",
  "campaign_key": "crosssell_reminder_personal-trainer",
  "services_heading_pre": "Waar kunt u nog meer",
  "services_heading_accent": "hulp",
  "services_heading_post": "bij krijgen?",
  "services_intro": "Op Trustlocal vergelijkt u de beste bedrijven bij u in de buurt voor ruim 50 verschillende diensten. Vraag gratis en vrijblijvend een prijsindicatie aan.",
  "grid_style": "",
  "stack_style": "display:none; mso-hide:all;",
  "stack2_style": "display:none; mso-hide:all;",
  "stack3_style": "display:none; mso-hide:all;",
  "service1_name": "Coach",
  "service1_label": "Voor uw volgende stap",
  "service1_text": "Coaching bij gewoontes en motivatie om uw doelen te bereiken.",
  "service1_price": "€ 50 – € 150 per uur",
  "service1_url": "https://trustlocal.be/belgie/coaching/?utm_source=brevo&utm_campaign=crosssell_reminder_personal-trainer&utm_medium=email&utm_content=kaart1",
  "service1_link_label": "Ontvang prijsindicatie",
  "service1_image_url": "https://img.mailinblue.com/9986607/images/rnb/original/6aaa43adba6d538d2bee14c9.jpg",
  "service1_image_alt": "Coach aan het werk: gesprek over persoonlijke en professionele doelen",
  "service2_name": "Psycholoog",
  "service2_label": "Voor een luisterend oor",
  "service2_text": "Een psycholoog als u ook meer grip wilt op hoe u zich voelt.",
  "service2_price": "€ 60 – € 80 per uur",
  "service2_url": "https://trustlocal.be/belgie/psycholoog/?utm_source=brevo&utm_campaign=crosssell_reminder_personal-trainer&utm_medium=email&utm_content=kaart2",
  "service2_link_label": "Ontvang prijsindicatie",
  "service2_image_url": "https://img.mailinblue.com/9986607/images/rnb/original/6a99ca85be55c06bad68f87e.jpg",
  "service2_image_alt": "Psycholoog aan het werk: rustig gesprek voeren met cliënt",
  "service3_name": "Relatietherapeut",
  "service3_label": "Voor uw relatie",
  "service3_text": "Begeleiding voor u samen als u ook aan uw relatie wilt werken.",
  "service3_price": "€ 80 – € 120 per uur",
  "service3_url": "https://trustlocal.be/belgie/relatietherapeut/?utm_source=brevo&utm_campaign=crosssell_reminder_personal-trainer&utm_medium=email&utm_content=kaart3",
  "service3_link_label": "Ontvang prijsindicatie",
  "service3_image_url": "https://img.mailinblue.com/9986607/images/rnb/original/6a99ca86b423db7c1ead99b9.jpg",
  "service3_image_alt": "Relatietherapeut aan het werk: stel begeleiden tijdens gesprek",
  "service4_name": "Schoonmaakbedrijf",
  "service4_label": "Voor meer tijd",
  "service4_text": "Een schoonmaakbedrijf, zodat er meer tijd is voor training en rust.",
  "service4_price": "€ 20 – € 40 per uur",
  "service4_url": "https://trustlocal.be/belgie/schoonmaakbedrijf/?utm_source=brevo&utm_campaign=crosssell_reminder_personal-trainer&utm_medium=email&utm_content=kaart4",
  "service4_link_label": "Ontvang prijsindicatie",
  "service4_image_url": "https://img.mailinblue.com/9986607/images/rnb/original/6a99ca84d6d15096d2e48ab9.jpg",
  "service4_image_alt": "Professionele schoonmaker aan het werk: keukenoppervlak grondig reinigen",
  "prices_note": "Gemiddelde prijzen op Trustlocal.be. Wat u betaalt, hangt af van uw situatie.",
  "closing_heading_pre": "Hebt u al een personal trainer",
  "closing_heading_accent": "gevonden?",
  "closing_heading_post": "",
  "closing_intro": "Uw aanvraag staat nog open. Hebt u al iemand gevonden of hebt u geen hulp meer nodig? Werk uw aanvraag bij in Mijn aanvragen.",
  "all_services_label": "Alle diensten bekijken",
  "all_services_url": "https://trustlocal.be/alle-diensten/?utm_source=brevo&utm_campaign=crosssell_reminder_personal-trainer&utm_medium=email&utm_content=allediensten",
  "dashboard_label": "Mijn aanvraag bijwerken"
}
